index-name,isin,share-name,currency,currency-hedged,correlation,currency-adjusted-correlation,expense-ratio,provider,replication-method,replication-model,dividend-policy-id,creation-date,size,tracking-error,tracking-difference,description,trackinsight-ticker
msci-world-index-990100,IE000BI8OT95,Amundi Core MSCI World UCITS ETF Acc - USD,USD,False,0.9585270792981536,0.9999498447230553,0.0012,Amundi,Direct,FullReplication,Capitalization,2024-01-18,11913223000,0.000870987378967164,0.0013523261073197645,"Amundi Core MSCI World UCITS ETF seeks to replicate, as closely as possible, whether the trend is rising or falling, the performance of the MSCI World Net Total Return USD Index (the Index), and to minimize the tracking error between the net asset value of the Sub-Fund and the performance of the Index. The anticipated level of tracking error, under normal market conditions, is indicated in the prospectus of the Sub-Fund. For further information, please refer to the fund prospectus or KID.",MWRD
msci-world-index-990100,FR0010315770,Amundi MSCI World Swap II UCITS ETF Dist - EUR,EUR,False,0.9636169124617746,0.9976220479727179,0.0030,Amundi,Indirect,UnfundedSwap,Distribution,2006-04-26,9466287000,,,"Amundi MSCI World Swap II UCITS ETF  seeks to replicate, as closely as possible, whether the trend is rising or falling, the performance of the MSCI World 100% Hedged to USD Net Total Return Index (the Index), and to minimize the tracking error between the net asset value of the Sub-Fund and the performance of the Index. The anticipated level of tracking error, under normal market conditions, is indicated in the prospectus of the Sub-Fund. For further information, please refer to the fund prospectus or KID.",WLD
msci-world-index-990100,IE00B0M62Q58,iShares MSCI World UCITS ETF (Dist) - USD,USD,False,0.9690366993685616,0.9974370677196658,0.0050,iShares,Direct,OptimizedSampling,Distribution,2005-10-28,8564906000,0.000317536712259914,-0.002883187218547481,"The Fund seeks to track the performance of an index composed of companies from 23 developed countries, covering 85% of the listed equities in each country. ",IDWR
msci-world-index-990100,IE00B60SX394,Invesco MSCI World UCITS ETF Acc - USD,USD,False,0.9635034064898693,0.9999409945555594,0.0019,Invesco,Indirect,UnfundedSwap,Capitalization,2009-04-02,7047337000,0.000193550285118982,0.0008037067420651811,"The Invesco MSCI World UCITS ETF Acc aims to provide the performance of the MSCI World Total Return (Net) Index. The MSCI World Total Return (Net) Index is a free float-adjusted market capitalisation weighted index that is designed to measure the equity market performance of developed markets. As of March 30, 2009 the MSCI World Index consists of companies from 23 developed market countries: Australia, Austria, Belgium, Canada, Denmark, Finland, France, Germany, Greece, Hong Kong, Ireland, Italy, Japan, Netherlands, New Zealand, Norway, Portugal, Singapore, Spain, Sweden, Switzerland, the United Kingdom, and the United States.",SC0J
msci-world-index-990100,LU2572257124,Amundi Core MSCI World Swap UCITS ETF Dist - USD,USD,False,0.9864416672677271,0.9986138093811252,0.002,Amundi,Indirect,UnfundedSwap,Distribution,2023-04-21,6546555000,0.00030970341862268,0.001464583274305894,"Amundi Core MSCI World Swap UCITS ETF seeks to replicate, as closely as possible, whether the trend is rising or falling, the performance of the MSCI World Index (the Index), and to minimize the tracking error between the net asset value of the Sub-Fund and the performance of the Index. The anticipated level of tracking error, under normal market conditions, is indicated in the prospectus of the Sub-Fund. For further information, please refer to the fund prospectus or KID.",AHYR
msci-world-index-990100,LU1681043599,Amundi MSCI World Swap UCITS ETF Acc - EUR,EUR,False,0.9633035839477859,0.9996865608616027,0.0038,Amundi,Indirect,UnfundedSwap,Capitalization,2018-04-18,6066540000,0.0003912441003276,-0.0036312485650208813,"Amundi MSCI World Swap UCITS ETF  seeks to replicate, as closely as possible, whether the trend is rising or falling, the performance of the MSCI Daily Net TR World Euro (the Index), and to minimize the tracking error between the net asset value of the Sub-Fund and the performance of the Index. The anticipated level of tracking error, under normal market conditions, is indicated in the prospectus of the Sub-Fund. For further information, please refer to the fund prospectus or KID.",CW8
msci-world-index-990100,IE00B441G979,iShares MSCI World EUR Hedged UCITS ETF (Acc) - EUR,EUR,True,0.9977131521106813,0.962377568774241,0.0055,iShares,Direct,OptimizedSampling,Capitalization,2010-09-30,5575660000,0.000904421273217989,-0.0038586387418381917,The Fund seeks to track the performance of an index composed of companies from developed countries which also hedges each currency exposure in the index back to Euro on a monthly basis. ,IWDE
msci-world-index-990100,LU0274208692,Xtrackers MSCI World Swap UCITS ETF 1C - USD,USD,False,0.9655225944606816,0.9998604086352217,0.0045,Xtrackers by DWS,Indirect,UnfundedSwap,Capitalization,2006-12-19,5565589000,0.000324544257299893,-0.0007710509122896493,The investment objective of the Fund is to track the performance of the MSCI Total Return Net World Index which is designed to reflect the performance of the shares of certain companies in various developed countries. The companies making up the Index are large and medium sized companies based on the combined value of a company’s readily available shares as compared to other companies. ,DBXW
msci-world-index-990100,IE00BK1PV551,Xtrackers MSCI World UCITS ETF 1D - USD,USD,False,0.9702246677883352,0.9971318453112579,0.0012,Xtrackers by DWS,Direct,OptimizedSampling,Distribution,2015-02-23,4962478000,0.00101199910719482,0.000978985390336925,"The investment objective of the Fund is to track the performance before fees and expenses of the Underlying Asset, which is the MSCI Total Return Net World Index. The Index is designed to reflect the performance of the shares of certain companies in various developed countries. The companies making up the Index are large and medium sized companies based on the combined value of a company’s readily available shares as compared to other companies. ",XDWL
msci-world-index-990100,DE000ETFL508,Deka MSCI World UCITS ETF - Distributing - EUR,EUR,False,0.9639503206071873,0.9969554844082509,0.003,Deka,Direct,FullReplication,Distribution,2018-09-25,4648350000,0.00153124530827774,-0.0028199210867574658,The Deka MSCI World UCITS ETF is a UCITS IV compliant mutual fund that tracks the performance of the MSCI World Index (Price Index). The index tracks the performance of the largest capital companies in global industrialized countries by market capitalization.,ELFW
msci-world-index-990100,IE00BD4TXV59,UBS Core MSCI World UCITS ETF Acc - USD,USD,False,0.9649959551400263,0.9998360183842265,0.0010,UBS,Direct,OptimizedSampling,Capitalization,2019-06-07,4184136000,0.000439144036486558,0.002024950943703009,"The investment objective is to replicate the price and return performance of the MSCI World Index net of fees. The stock exchange price may differ from the net asset value. The MSCI World Index is a free float-adjusted market capitalization weighted index that is designed to measure the equity market performance of developed markets globally. Securities are free float adjusted, screened by size, liquidity and minimum free float. The index represents companies within these countries that are available to investors worldwide.",UETW
msci-world-index-990100,LU2263803533,Xtrackers MSCI World Swap UCITS ETF 1D - USD,USD,False,0.9564759164280493,0.9976561002743887,0.0019,Xtrackers by DWS,Indirect,UnfundedSwap,Distribution,2021-03-03,3006256000,0.000307933578270936,0.0022943755851155224,The investment objective of the Fund is to track the performance of the MSCI Total Return Net World Index which is designed to reflect the performance of the shares of certain companies in various developed countries. The companies making up the Index are large and medium sized companies based on the combined value of a company’s readily available shares as compared to other companies. ,XWD1
msci-world-index-990100,IE00B8BVCK12,iShares MSCI World CHF Hedged UCITS ETF (Acc) - CHF,CHF,True,nan,nan,0.0055,iShares,Direct,OptimizedSampling,Capitalization,2012-11-30,1857644000,0.00220324048441831,-0.0035813890732295994,The Fund seeks to track the performance of an index composed of companies from developed countries which also hedges each currency exposure in the index back to CHF on a monthly basis. ,IWDC
msci-world-index-990100,IE00BKBF6H24,iShares Core MSCI World UCITS ETF EUR Hedged (Dist) - EUR,EUR,True,0.9912505421925449,0.9366949090970886,0.003,iShares,Direct,OptimizedSampling,Distribution,2019-06-05,1581349000,,,The Fund seeks to track the performance of an index composed of companies from developed countries. ,IWLE
msci-world-index-990100,LU0340285161,UBS MSCI World UCITS ETF - USD,USD,False,0.9682383251523934,0.9974506797006255,0.0030,UBS,Direct,FullReplication,Distribution,2008-06-25,1525523000,0.000480593979348207,-0.0024240522282802067,The investment objective is to replicate the price and return performance of the MSCI World Index net of fees. The stock exchange price may differ from the net asset value. ,WRDUSA
msci-world-index-990100,IE000CNSFAR2,Amundi Core MSCI World UCITS ETF Dist - USD,USD,False,0.9786166422679913,0.9991807644097072,0.0012,Amundi,Direct,FullReplication,Distribution,2022-06-09,1423973000,0.000872612342308917,0.001345671532482654,"Amundi Core MSCI World UCITS ETF seeks to replicate, as closely as possible, whether the trend is rising or falling, the performance of the MSCI World Net Total Return USD Index (the Index), and to minimize the tracking error between the net asset value of the Sub-Fund and the performance of the Index. The anticipated level of tracking error, under normal market conditions, is indicated in the prospectus of the Sub-Fund. For further information, please refer to the fund prospectus or KID.",MWOE
msci-world-index-990100,IE000UQND7H4,HSBC MSCI World UCITS ETF (C) - USD,USD,False,0.9821279940952278,0.9999851678829957,0.0015,HSBC,Direct,OptimizedSampling,Capitalization,2022-06-29,1291243000,0.00171594236059034,0.0006099827776363271,"The investment objective of the Fund is to replicate the performance of the MSCI World Index (the ""Index""), while minimising as far as possible the tracking error between the Fund's performance and that of the Index. The Index is a market-capitalisation weighted index designed to measure the performance of the largest companies of the world's developed equity markets, including Austria, Belgium, Denmark, Finland, France, Germany, Greece, Ireland, Italy, Israel, The Netherlands, Norway, Portugal, Spain, Sweden, Switzerland, United Kingdom, Hong Kong, Japan, Singapore, Australia, New Zealand, Canada and USA, as defined by the Index Provider.",HMWA
msci-world-index-990100,IE00B7KQ7B66,UBS Core MSCI World UCITS ETF A-dis - USD,USD,False,0.9684981428300024,0.9973341670365907,0.0006,UBS,Direct,OptimizedSampling,Distribution,2012-04-11,1229693000,0.000434559506075216,0.0020053492063984513,"The investment objective is to replicate the price and return performance of the MSCI World Index net of fees. The stock exchange price may differ from the net asset value. The MSCI World Index is a free float-adjusted market capitalization weighted index that is designed to measure the equity market performance of developed markets globally. Securities are free float adjusted, screened by size, liquidity and minimum free float. The index represents companies within these countries that are available to investors worldwide.",UBU7
msci-world-index-990100,LU0659579733,Xtrackers MSCI World Swap UCITS ETF 4C - EUR Hedged,EUR,True,0.9979015176702809,0.9662148476219431,0.0039,Xtrackers by DWS,Indirect,UnfundedSwap,Capitalization,2013-08-22,1168253000,,,The investment objective of the Fund is to track the performance of the MSCI Total Return Net World Index which is designed to reflect the performance of the shares of certain companies in various developed countries. The companies making up the Index are large and medium sized companies based on the combined value of a company’s readily available shares as compared to other companies. ,XWEH
msci-world-index-990100,IE00BD45YS76,iShares Core MSCI World UCITS ETF GBP Hedged (Dist) - GBP,GBP,True,nan,nan,0.003,iShares,Direct,OptimizedSampling,Distribution,2017-05-22,1116327000,,,The Fund seeks to track the performance of an index composed of companies from developed countries. ,IWDG
msci-world-index-990100,FR0011660927,Amundi MSCI World Swap II UCITS ETF Dist - EUR Hedged,EUR,True,0.9930041097296028,0.9429660829483517,0.0030,Amundi,Indirect,UnfundedSwap,Distribution,2014-01-15,1101595000,4.31166830667113e-05,-0.0008744418982290984,"Amundi MSCI World Swap II UCITS ETF  seeks to replicate, as closely as possible, whether the trend is rising or falling, the performance of the MSCI World 100% Hedged to USD Net Total Return Index (the Index), and to minimize the tracking error between the net asset value of the Sub-Fund and the performance of the Index. The anticipated level of tracking error, under normal market conditions, is indicated in the prospectus of the Sub-Fund. For further information, please refer to the fund prospectus or KID.",WLDH
msci-world-index-990100,IE0002XZSHO1,iShares MSCI World Swap PEA UCITS ETF - EUR,EUR,False,0.8017795360539601,0.9990233471966083,0.0025,iShares,Indirect,UnfundedSwap,Capitalization,2024-03-26,1002324000,0.000414852050971814,-0.0014461204202236662,"The Fund seeks a return on your investment, through a combination of capital growth and income on the Fund's assets, which is similar to the net total return of the MSCI World Index, the Fund's benchmark index (the Index).",AO00
msci-world-index-990100,IE000QMIHY81,HSBC MSCI World UCITS ETF - EUR Hedged,EUR,True,0.9980048885630796,0.9933065486670072,0.0016,HSBC,Direct,OptimizedSampling,Capitalization,2022-12-08,710167000,,,"The investment objective of the Fund is to replicate the performance of the MSCI World Index (the ""Index""), while minimising as far as possible the tracking error between the Fund's performance and that of the Index. The Index is a market-capitalisation weighted index designed to measure the performance of the largest companies of the world's developed equity markets, including Austria, Belgium, Denmark, Finland, France, Germany, Greece, Ireland, Italy, Israel, The Netherlands, Norway, Portugal, Spain, Sweden, Switzerland, United Kingdom, Hong Kong, Japan, Singapore, Australia, New Zealand, Canada and USA, as defined by the Index Provider.",H41H
msci-world-index-990100,IE000BZ1HVL2,SPDR MSCI World UCITS ETF Acc - EUR Hedged,EUR,True,0.996132050443746,0.9897407165676682,0.0017,SPDR,Direct,OptimizedSampling,Capitalization,2023-07-20,691235000,,,The investment objective of the Fund is to track the performance of large and mid-sized equities in developed markets globally.,SPFH
msci-world-index-990100,IE000N6LBS91,UBS Core MSCI World UCITS ETF - CHF Hedged,CHF,True,nan,nan,0.0009,UBS,Direct,OptimizedSampling,Capitalization,2024-01-31,611291000,0.00231269408255866,0.0019506785388077974,"The investment objective is to replicate the price and return performance of the MSCI World Index net of fees. The stock exchange price may differ from the net asset value. The MSCI World Index is a free float-adjusted market capitalization weighted index that is designed to measure the equity market performance of developed markets globally. Securities are free float adjusted, screened by size, liquidity and minimum free float. The index represents companies within these countries that are available to investors worldwide.",WORLD
msci-world-index-990100,IE00BZ1BS790,Xtrackers MSCI World UCITS ETF 2D - GBP Hedged,GBP,True,nan,nan,0.0017,Xtrackers by DWS,Direct,OptimizedSampling,Distribution,2017-07-31,548711000,,,"The investment objective of the Fund is to track the performance before fees and expenses of the Underlying Asset, which is the MSCI Total Return Net World Index. The Index is designed to reflect the performance of the shares of certain companies in various developed countries. The companies making up the Index are large and medium sized companies based on the combined value of a company’s readily available shares as compared to other companies. ",XDWG
msci-world-index-990100,IE00B42YS929,iShares MSCI World GBP Hedged UCITS ETF (Acc) - GBP,GBP,True,nan,nan,0.0055,iShares,Direct,OptimizedSampling,Capitalization,2010-09-30,514204000,0.000590222721166912,-0.004192708399853081,The Fund seeks to track the performance of an index composed of companies which also hedges each currency exposure in the index back to GBP on a monthly basis. ,IGWD
msci-world-index-990100,FR0014003N93,Amundi MSCI World Swap II UCITS ETF Acc - EUR Hedged,EUR,True,0.9978694316677542,0.9617937879189156,0.003,Amundi,Indirect,UnfundedSwap,Capitalization,2021-06-15,485598000,5.9552502827002e-05,-0.0008700089335948203,"Amundi MSCI World Swap II UCITS ETF  seeks to replicate, as closely as possible, whether the trend is rising or falling, the performance of the MSCI World 100% Hedged to USD Net Total Return Index (the Index), and to minimize the tracking error between the net asset value of the Sub-Fund and the performance of the Index. The anticipated level of tracking error, under normal market conditions, is indicated in the prospectus of the Sub-Fund. For further information, please refer to the fund prospectus or KID.",WLDHC
msci-world-index-990100,FR0014003IY1,Amundi MSCI World Swap II UCITS ETF Acc - EUR,EUR,False,0.9652089451862522,0.9996849991535959,0.0030,Amundi,Indirect,UnfundedSwap,Capitalization,2021-06-30,483760000,,,"Amundi MSCI World Swap II UCITS ETF  seeks to replicate, as closely as possible, whether the trend is rising or falling, the performance of the MSCI World 100% Hedged to USD Net Total Return Index (the Index), and to minimize the tracking error between the net asset value of the Sub-Fund and the performance of the Index. The anticipated level of tracking error, under normal market conditions, is indicated in the prospectus of the Sub-Fund. For further information, please refer to the fund prospectus or KID.",WLDC
msci-world-index-990100,IE000OHHIBC6,iShares Core MSCI World UCITS ETF (Dist) - USD,USD,False,0.982182797218329,0.9995526071813482,0.002,iShares,Direct,OptimizedSampling,Distribution,2023-07-26,436229000,0.000303988504147935,0.00023936017076175566,The Fund seeks to track the performance of an index composed of companies from developed countries. ,IWDD
msci-world-index-990100,LU2655993207,Amundi MSCI World Swap UCITS ETF Dist - EUR,EUR,False,0.9625111718224595,0.9995244478392543,0.0038,Amundi,Indirect,UnfundedSwap,Distribution,2014-05-13,418285000,0.000389760698761967,-0.0036330521769866652,"Amundi MSCI World Swap UCITS ETF  seeks to replicate, as closely as possible, whether the trend is rising or falling, the performance of the MSCI Daily Net TR World Euro (the Index), and to minimize the tracking error between the net asset value of the Sub-Fund and the performance of the Index. The anticipated level of tracking error, under normal market conditions, is indicated in the prospectus of the Sub-Fund. For further information, please refer to the fund prospectus or KID.",EWLD
msci-world-index-990100,IE000ONQ3X90,Xtrackers MSCI World UCITS ETF 2C - EUR Hedged,EUR,True,0.9947751437770246,0.9861234207131976,0.0017,Xtrackers by DWS,Direct,OptimizedSampling,Capitalization,2023-10-11,331195000,,,"The investment objective of the Fund is to track the performance before fees and expenses of the Underlying Asset, which is the MSCI Total Return Net World Index. The Index is designed to reflect the performance of the shares of certain companies in various developed countries. The companies making up the Index are large and medium sized companies based on the combined value of a company’s readily available shares as compared to other companies. ",XWEU
msci-world-index-990100,FR001400U5Q4,Amundi PEA Monde MSCI World UCITS ETF Acc - EUR,EUR,False,0.9438354401221207,0.9968223250651714,0.002,Amundi,Indirect,UnfundedSwap,Capitalization,2025-03-11,312120000,0.000399591589539658,-2.673610322207139e-05,Amundi PEA Monde (MSCI World) UCITS ETF seeks to replicate as closely as possible the MSCI World Index in EUR,DCAM
msci-world-index-990100,IE000F9IDGB5,iShares MSCI World Swap UCITS ETF - USD,USD,False,0.9442735668612149,0.9999292744644547,0.0012,iShares,Indirect,UnfundedSwap,Capitalization,2024-03-15,267905000,0.00037306084067154,0.0016666923397577825,"The fund aims to achieve a return on your investment, through a combination of capital growth and income on the Fund’s assets, which reflects the net total return of the MSCI World Index, the Fund’s benchmark index (Index).",IWDS
msci-world-index-990100,IE0005POVJH8,SPDR MSCI World UCITS ETF Dist - GBP Hedged,GBP,True,nan,nan,0.0017,SPDR,Direct,OptimizedSampling,Distribution,2023-07-19,257784000,0.00221193887592622,-0.0014384759288693513,The investment objective of the Fund is to track the performance of large and mid-sized equities in developed markets globally.,SWLH
msci-world-index-990100,IE000TB15RC6,UBS Core MSCI World UCITS ETF - EUR hedged,EUR,True,0.9877368388135406,0.9720616881684546,0.0013,UBS,Direct,OptimizedSampling,Capitalization,2024-04-26,170744000,0.00168776989741506,-4.338574827123157e-05,"The investment objective is to replicate the price and return performance of the MSCI World Index net of fees. The stock exchange price may differ from the net asset value. The MSCI World Index is a free float-adjusted market capitalization weighted index that is designed to measure the equity market performance of developed markets globally. Securities are free float adjusted, screened by size, liquidity and minimum free float. The index represents companies within these countries that are available to investors worldwide.",BCFI
msci-world-index-990100,LU1681043672,Amundi MSCI World Swap UCITS ETF Acc - USD,USD,False,0.9645389938504855,0.9998172482750693,0.0038,Amundi,Indirect,UnfundedSwap,Capitalization,2018-04-18,160737000,0.000392456343002102,-0.0038431083238656292,"Amundi MSCI World Swap UCITS ETF  seeks to replicate, as closely as possible, whether the trend is rising or falling, the performance of the MSCI Daily Net TR World Euro (the Index), and to minimize the tracking error between the net asset value of the Sub-Fund and the performance of the Index. The anticipated level of tracking error, under normal market conditions, is indicated in the prospectus of the Sub-Fund. For further information, please refer to the fund prospectus or KID.",CW8U
msci-world-index-990100,IE000KLSD4Y8,UBS Core MSCI World UCITS ETF - GBP Hedged,GBP,True,nan,nan,0.0009,UBS,Direct,OptimizedSampling,Distribution,2024-04-26,100009000,0.00106421179439669,0.0015816657499418535,"The investment objective is to replicate the price and return performance of the MSCI World Index net of fees. The stock exchange price may differ from the net asset value. The MSCI World Index is a free float-adjusted market capitalization weighted index that is designed to measure the equity market performance of developed markets globally. Securities are free float adjusted, screened by size, liquidity and minimum free float. The index represents companies within these countries that are available to investors worldwide.",WRDG
msci-world-index-990100,IE0009KLWT21,Xtrackers MSCI World UCITS ETF 3C - CHF Hedged,CHF,True,nan,nan,0.0017,Xtrackers by DWS,Direct,OptimizedSampling,Capitalization,2023-10-11,61994000,,,"The investment objective of the Fund is to track the performance before fees and expenses of the Underlying Asset, which is the MSCI Total Return Net World Index. The Index is designed to reflect the performance of the shares of certain companies in various developed countries. The companies making up the Index are large and medium sized companies based on the combined value of a company’s readily available shares as compared to other companies. ",XWCH
msci-world-index-990100,IE000WMRNBB0,HSBC MSCI World UCITS ETF - CHF Hedged,CHF,True,nan,nan,0.0018,HSBC,Direct,OptimizedSampling,Capitalization,2023-05-25,55756000,,,"The investment objective of the Fund is to replicate the performance of the MSCI World Index (the ""Index""), while minimising as far as possible the tracking error between the Fund's performance and that of the Index. The Index is a market-capitalisation weighted index designed to measure the performance of the largest companies of the world's developed equity markets, including Austria, Belgium, Denmark, Finland, France, Germany, Greece, Ireland, Italy, Israel, The Netherlands, Norway, Portugal, Spain, Sweden, Switzerland, United Kingdom, Hong Kong, Japan, Singapore, Australia, New Zealand, Canada and USA, as defined by the Index Provider.",HWDC
msci-world-index-990100,FR0011669845,Amundi MSCI World Swap II UCITS ETF Dist - USD Hedged,USD,True,0.9477526745207169,0.9982331455241203,0.003,Amundi,Indirect,UnfundedSwap,Distribution,2014-01-15,33150000,3.76998158618233e-05,-0.0007871666311695196,"Amundi MSCI World Swap II UCITS ETF  seeks to replicate, as closely as possible, whether the trend is rising or falling, the performance of the MSCI World 100% Hedged to USD Net Total Return Index (the Index), and to minimize the tracking error between the net asset value of the Sub-Fund and the performance of the Index. The anticipated level of tracking error, under normal market conditions, is indicated in the prospectus of the Sub-Fund. For further information, please refer to the fund prospectus or KID.",WLDU
